title,price,rent_fee,wojewodztwo,powiat,miasto,dzielnica,ulica,location,rooms,advertiser_type,heating,floor,finishing_state,available_from,additional_info,building_year,elevator,building_type,building_material,windows,safety,equipment,security,media,url,scrape_date
Nowoczesne 2-pokojowe mieszkanie z loggią,3 950 zł,630,mazowieckie,brak informacji,Warszawa,Białołęka,ul. Marywilska,"ul. Marywilska, Żerań, Białołęka, Warszawa, mazowieckie",2,prywatny,miejskie,3/6,do zamieszkania,2025-05-18,"balkon, tak, garaż/miejsce parkingowe, pom. użytkowe, Wynajmę również studentom",2021,tak,apartamentowiec,brak informacji,brak informacji,monitoring / ochronateren zamknięty,"meble, pralka, zmywarka, lodówka, kuchenka, piekarnik, telewizor","drzwi / okna antywłamaniowe, domofon / wideofon",internet,https://www.otodom.pl/pl/oferta/nowoczesne-2-pokojowe-mieszkanie-z-loggia-ID4vncD,2025-05-14 03:25:49
Wynajmę od zaraz piękne M4 w top dzielnicy! HIT! 0% prowizji dla biura,3 500 zł,brak informacji,śląskie,brak informacji,Częstochowa,Częstochówka-Parkitka,ul. Poleska,"ul. Poleska, Parkitka, Częstochówka-Parkitka, Częstochowa, śląskie",3,biuro nieruchomości,miejskie,parter/4,do zamieszkania,2025-03-14,"ogródek, taras, garaż/miejsce parkingowe",2024,nie,apartamentowiec,pustak,plastikowe,teren zamkniętymonitoring / ochrona,"zmywarka, lodówka, meble, piekarnik, kuchenka, telewizor, pralka, klimatyzacja","system alarmowy, drzwi / okna antywłamaniowe, domofon / wideofon",telewizja kablowainternet,https://www.otodom.pl/pl/oferta/wynajme-od-zaraz-piekne-m4-w-top-dzielnicy-hit-0-prowizji-dla-biura-ID4wVyv,2025-05-14 03:25:49
NOWOCZESNE MIESZKANIE PO GENERALNYM REMONCIE,2 000 zł,brak informacji,łódzkie,brak informacji,Łódź,Bałuty,brak informacji,"Radogoszcz, Bałuty, Łódź, łódzkie",1,prywatny,miejskie,10/11,do zamieszkania,2025-05-16,"balkon, tak, oddzielna kuchnia, Wynajmę również studentom",brak informacji,tak,blok,brak informacji,plastikowe,brak informacji,"meble, pralka, zmywarka, lodówka, kuchenka, piekarnik",brak informacji,brak informacji,https://www.otodom.pl/pl/oferta/nowoczesne-mieszkanie-po-generalnym-remoncie-ID4vmWd,2025-05-14 03:25:50
Wynajmę mieszkanie w centrum Wrzeszcza,3 400 zł,590,pomorskie,brak informacji,Gdańsk,Wrzeszcz Górny,brak informacji,"Wrzeszcz Górny, Gdańsk, pomorskie",2,prywatny,miejskie,1/4,do zamieszkania,2025-05-01,"balkon, tak, garaż/miejsce parkingowe, tylko dla niepalących, oddzielna kuchnia, pom. użytkowe, Wynajmę również studentom",2020,tak,apartamentowiec,pustak,plastikowe,monitoring / ochrona,"meble, pralka, zmywarka, lodówka, kuchenka, piekarnik, telewizor","drzwi / okna antywłamaniowe, domofon / wideofon",telewizja kablowainternet,https://www.otodom.pl/pl/oferta/wynajme-mieszkanie-w-centrum-wrzeszcza-ID4sy4F,2025-05-14 03:25:50
Klimatyczny apartament,3 300 zł,458,pomorskie,brak informacji,Gdynia,Śródmieście,ul. 3 Maja,"ul. 3 Maja, Śródmieście, Gdynia, pomorskie",2,prywatny,miejskie,5/5,do zamieszkania,2025-09-15,"balkon, tak, piwnica, tylko dla niepalących, Wynajmę również studentom",1939,tak,kamienica,cegła,plastikowe,teren zamknięty,"meble, pralka, zmywarka, lodówka, kuchenka, piekarnik, telewizor",brak informacji,internettelewizja kablowa,https://www.otodom.pl/pl/oferta/klimatyczny-apartament-ID4vndp,2025-05-14 03:25:51
