title,price,rent_fee,location,rooms,advertiser_type,heating,floor,finishing_state,available_from,additional_info,building_year,elevator,building_type,building_material,windows,safety,equipment,security,media,id,url,scrape_date
Centrum 2-Pokojowe 49m2 Bezpośrednio,2 500 zł,+ Czynsz 54 zł,"ul. Grzegórzecka, Wesoła Wschód, Grzegórzki, Kraków, małopolskie",2,prywatny,gazowe,2/3,do zamieszkania,2025-05-13,,1900,nie,kamienica,cegła,plastikowe,monitoring / ochronateren zamknięty,"meble, pralka, lodówka, klimatyzacja",,internet,ID4vmEV,https://www.otodom.pl/pl/oferta/centrum-2-pokojowe-49m2-bezposrednio-ID4vmEV,2025-05-13 16:26:54
"Hoża 55, Warszawa - top lokalizacja - wynajmę bezpośrednio.",6 800 zł,+ Czynsz 1 300 zł,"ul. Hoża, Śródmieście Południowe, Śródmieście, Warszawa, mazowieckie",2,prywatny,miejskie,1/5,do zamieszkania,2025-05-13,balkontarasgaraż/miejsce parkingowepom. użytkowepiwnica,2010,tak,kamienica,cegła,drewniane,monitoring / ochronateren zamknięty,"meble, pralka, zmywarka, lodówka, kuchenka, piekarnik, telewizor","drzwi / okna antywłamaniowe, domofon / wideofon, system alarmowy",internettelewizja kablowa,ID4vmza,https://www.otodom.pl/pl/oferta/hoza-55-warszawa-top-lokalizacja-wynajme-bezposrednio-ID4vmza,2025-05-13 16:26:56
"Mieszkanie 2 pokoje, duży balkon z pięknym widokiem KLIMATYZACJA",2 800 zł,+ Czynsz 600 zł,"ul. Jodłowicka, Pracze Odrzańskie, Fabryczna, Wrocław, dolnośląskie",2,prywatny,miejskie,1/3,do zamieszkania,2025-05-14,balkonoddzielna kuchnia,2016,tak,blok,pustak,plastikowe,monitoring / ochronateren zamknięty,"meble, pralka, zmywarka, lodówka, kuchenka, piekarnik, telewizor, klimatyzacja",,internettelewizja kablowa,ID4vmlu,https://www.otodom.pl/pl/oferta/mieszkanie-2-pokoje-duzy-balkon-z-pieknym-widokiem-klimatyzacja-ID4vmlu,2025-05-13 16:26:59
"piękne mieszkanie do wynajęcia przy Parku Połud., blisko UE, tramwaj",3 800 zł,+ Czynsz 2 400 zł,"ul. Ślężna, Powstańców Śląskich, Krzyki, Wrocław, dolnośląskie",2,prywatny,gazowe,2,do zamieszkania,2025-05-12,balkontarastakgaraż/miejsce parkingowepom. użytkowepiwnicaoddzielna kuchniaWynajmę również studentom,1950,nie,kamienica,cegła,plastikowe,,"meble, pralka, zmywarka, lodówka, kuchenka, piekarnik, telewizor","drzwi / okna antywłamaniowe, domofon / wideofon",internettelewizja kablowa,ID4vmQF,https://www.otodom.pl/pl/oferta/piekne-mieszkanie-do-wynajecia-przy-parku-polud-blisko-ue-tramwaj-ID4vmQF,2025-05-13 16:27:01
Przyjazne zwierzętom I Nowe I Niska kaucja,"3 010,27 zł",,"ul. Śniadeckich, Grunwald, Grunwald, Poznań, wielkopolskie",2,biuro nieruchomości,miejskie,5/5,do zamieszkania,2025-05-08,takgaraż/miejsce parkingoweoddzielna kuchniaWynajmę również studentom,2025,tak,,,plastikowe,monitoring / ochrona,"meble, pralka, zmywarka, lodówka, kuchenka, piekarnik",,internettelewizja kablowa,ID4vjwX,https://www.otodom.pl/pl/oferta/przyjazne-zwierzetom-i-nowe-i-niska-kaucja-ID4vjwX,2025-05-13 16:27:04
